{
  "profile": "ASIEP",
  "profile_version": "0.1.0",
  "matrix_version": "0.1.0",
  "created_at": "2026-05-05T07:00:00Z",
  "standards": [
    "ASIEP",
    "PROV",
    "OpenTelemetry GenAI",
    "LangSmith-like Trace",
    "FDO-like Record",
    "RO-Crate-like Metadata",
    "AI Governance Logging"
  ],
  "mappings": [
    {
      "asiep_field": "profile_version, @context",
      "field_group": "profile",
      "required": true,
      "invariant_ids": ["I1"],
      "validator_rules": ["JSON Schema"],
      "error_codes": ["SCHEMA", "SCHEMA_CONST_MISMATCH"],
      "prov_mapping": "prov:Entity type and JSON-LD context",
      "otel_mapping": "resource/schema metadata, partial only",
      "langsmith_mapping": "project/run metadata, partial only",
      "fdo_mapping": "fdo_record.metadata.conforms_to",
      "rocrate_mapping": "root Dataset conformsTo profile entity",
      "governance_mapping": "log schema version and policy version",
      "lossiness": "partial",
      "notes": "M1 profile manifest and JSON-LD context provide the agent entrypoint."
    },
    {
      "asiep_field": "profile_id, improvement.id",
      "field_group": "record",
      "required": true,
      "invariant_ids": ["I1"],
      "validator_rules": ["JSON Schema"],
      "error_codes": ["SCHEMA_REQUIRED_FIELD"],
      "prov_mapping": "prov:Entity identifier for evidence record and improvement activity",
      "otel_mapping": "trace_id/span_id relation, partial only",
      "langsmith_mapping": "trace_id and run_id, partial only",
      "fdo_mapping": "fdo_record.metadata.evidence_record_id",
      "rocrate_mapping": "File entity evidence/evidence.json",
      "governance_mapping": "audit record id",
      "lossiness": "partial",
      "notes": "Record identity is local and deterministic; no global PID is claimed."
    },
    {
      "asiep_field": "improvement.parent_profile_id, subject_agent.version",
      "field_group": "lineage",
      "required": false,
      "invariant_ids": ["I1"],
      "validator_rules": ["JSON Schema"],
      "error_codes": ["SCHEMA_TYPE_MISMATCH"],
      "prov_mapping": "prov:used base_blueprint and candidate_blueprint entities",
      "otel_mapping": "gen_ai.agent.version",
      "langsmith_mapping": "runs[].metadata.agent_version",
      "fdo_mapping": "fdo_record.metadata.cycle_id and package_id",
      "rocrate_mapping": "PackagingAction object/result relation",
      "governance_mapping": "change lineage and release lineage",
      "lossiness": "partial",
      "notes": "Lineage is sufficient for local evidence review but not a deployment graph."
    },
    {
      "asiep_field": "improvement.summary, improvement.hypothesis",
      "field_group": "trigger",
      "required": true,
      "invariant_ids": ["I1"],
      "validator_rules": ["JSON Schema"],
      "error_codes": ["SCHEMA_REQUIRED_FIELD"],
      "prov_mapping": "prov:Activity description",
      "otel_mapping": "span name and attributes",
      "langsmith_mapping": "run name, tags, and metadata",
      "fdo_mapping": "metadata.content_type and refers_to",
      "rocrate_mapping": "Dataset name and PackagingAction",
      "governance_mapping": "change request reason",
      "lossiness": "partial",
      "notes": "Trigger text is descriptive evidence, not an automated approval."
    },
    {
      "asiep_field": "subject_agent, lifecycle[].actor",
      "field_group": "actors",
      "required": true,
      "invariant_ids": ["I1"],
      "validator_rules": ["JSON Schema"],
      "error_codes": ["SCHEMA_REQUIRED_FIELD"],
      "prov_mapping": "prov:Agent and prov:wasAssociatedWith",
      "otel_mapping": "gen_ai.agent.id and gen_ai.agent.name",
      "langsmith_mapping": "runs[].metadata.agent_id",
      "fdo_mapping": "metadata.agent_id",
      "rocrate_mapping": "SoftwareApplication and agent fields",
      "governance_mapping": "actor and system identity",
      "lossiness": "partial",
      "notes": "Actor semantics are local fixture identities in M4-M6."
    },
    {
      "asiep_field": "subject_agent.implementation, import source metadata",
      "field_group": "runtime",
      "required": false,
      "invariant_ids": ["I1"],
      "validator_rules": ["JSON Schema"],
      "error_codes": ["SCHEMA_TYPE_MISMATCH"],
      "prov_mapping": "prov:SoftwareAgent or activity metadata",
      "otel_mapping": "GenAI framework and operation spans",
      "langsmith_mapping": "run_type, project_name, tags",
      "fdo_mapping": "operations commands",
      "rocrate_mapping": "SoftwareApplication",
      "governance_mapping": "runtime and environment metadata",
      "lossiness": "partial",
      "notes": "M6 uses local OTel-like and LangSmith-like fixtures only."
    },
    {
      "asiep_field": "evidence[] and evidence[].refs",
      "field_group": "evidence",
      "required": true,
      "invariant_ids": ["I4", "I10"],
      "validator_rules": ["_check_evidence_refs", "_check_reference_digests"],
      "error_codes": ["REF_UNRESOLVED", "REF_DIGEST_FORMAT", "BUNDLE_REF_UNDECLARED"],
      "prov_mapping": "prov:Entity evidence nodes",
      "otel_mapping": "span events and external artifact refs",
      "langsmith_mapping": "runs, feedback, inputs_ref, outputs_ref",
      "fdo_mapping": "refers_to and integrity fields",
      "rocrate_mapping": "File entities and hasPart relations",
      "governance_mapping": "evidence appendix and audit references",
      "lossiness": "partial",
      "notes": "M3 binds evidence refs to local artifacts and SHA-256 digests."
    },
    {
      "asiep_field": "safety_checks, flip_counts",
      "field_group": "evaluation",
      "required": true,
      "invariant_ids": ["I6", "I7", "I8"],
      "validator_rules": ["_check_gate_decisions"],
      "error_codes": ["INV_SAFETY_REGRESSION", "INV_FLIP_THRESHOLD"],
      "prov_mapping": "prov:Activity evaluation using evidence entities",
      "otel_mapping": "evaluator spans with score attributes",
      "langsmith_mapping": "feedback score and evaluator runs",
      "fdo_mapping": "metadata state and validation summaries",
      "rocrate_mapping": "evaluation artifacts as File entities",
      "governance_mapping": "risk and evaluation controls",
      "lossiness": "partial",
      "notes": "Gate reproducibility depends on safety and threshold fields."
    },
    {
      "asiep_field": "gates[] and gates[].gate_report_ref",
      "field_group": "gate",
      "required": true,
      "invariant_ids": ["I5", "I6", "I7", "I8"],
      "validator_rules": ["JSON Schema", "_check_gate_decisions"],
      "error_codes": ["INV_MISSING_GATE_REPORT", "INV_SAFETY_REGRESSION", "INV_FLIP_THRESHOLD"],
      "prov_mapping": "prov:Activity gate decision and gate report entity",
      "otel_mapping": "gate_report span or artifact marker",
      "langsmith_mapping": "gate report run marker",
      "fdo_mapping": "metadata.state and operations.validate",
      "rocrate_mapping": "gate_report artifact File entity",
      "governance_mapping": "approval gate and decision log",
      "lossiness": "partial",
      "notes": "M2 repairer recommends reject rather than falsifying safety evidence."
    },
    {
      "asiep_field": "lifecycle[]",
      "field_group": "compliance",
      "required": true,
      "invariant_ids": ["I2", "I3"],
      "validator_rules": ["_check_state_machine"],
      "error_codes": ["STATE_TRANSITION"],
      "prov_mapping": "prov:Activity sequence with states as attributes",
      "otel_mapping": "ordered span events, partial only",
      "langsmith_mapping": "ordered runs, partial only",
      "fdo_mapping": "metadata.state",
      "rocrate_mapping": "PackagingAction and result relation",
      "governance_mapping": "workflow state log",
      "lossiness": "partial",
      "notes": "ASIEP state machine is evidence lifecycle, not deployment automation."
    },
    {
      "asiep_field": "digest fields, bundle integrity, package integrity",
      "field_group": "integrity",
      "required": true,
      "invariant_ids": ["I10"],
      "validator_rules": ["_check_reference_digests", "asiep_resolver digest checks"],
      "error_codes": ["REF_DIGEST_FORMAT", "BUNDLE_DIGEST_MISMATCH", "PACKAGE_DIGEST_MISMATCH"],
      "prov_mapping": "prov:value or checksum attributes on entities",
      "otel_mapping": "artifact digest attributes, not native in minimal fixture",
      "langsmith_mapping": "metadata digest fields, not native in minimal fixture",
      "fdo_mapping": "integrity.hash_algorithm and digest fields",
      "rocrate_mapping": "sha256 fields on File entities",
      "governance_mapping": "tamper evidence and hash audit",
      "lossiness": "partial",
      "notes": "M3 and M5 recompute local SHA-256 digests."
    },
    {
      "asiep_field": "bundle.json and artifacts[]",
      "field_group": "bundle",
      "required": false,
      "invariant_ids": ["I4", "I10"],
      "validator_rules": ["asiep_resolver.resolve_bundle"],
      "error_codes": ["BUNDLE_ARTIFACT_MISSING", "BUNDLE_PATH_ESCAPE", "BUNDLE_DIGEST_MISMATCH"],
      "prov_mapping": "prov:Collection of evidence entities",
      "otel_mapping": "external artifact storage refs",
      "langsmith_mapping": "inputs_ref and outputs_ref artifact refs",
      "fdo_mapping": "refers_to.bundle_manifest",
      "rocrate_mapping": "Dataset hasPart artifact files",
      "governance_mapping": "evidence package attachment manifest",
      "lossiness": "partial",
      "notes": "Resolver is local-only and forbids path escape."
    },
    {
      "asiep_field": "import_request, import_result",
      "field_group": "import",
      "required": false,
      "invariant_ids": ["I1", "I4"],
      "validator_rules": ["asiep_importer.import_trace"],
      "error_codes": ["IMPORT_REQUIRED_ROLE_MISSING", "IMPORT_SENSITIVE_CONTENT_BLOCKED"],
      "prov_mapping": "prov:Activity trace-to-evidence transformation",
      "otel_mapping": "OTel-like trace fixture source",
      "langsmith_mapping": "LangSmith-like trace fixture source",